Nametag,Japanese,English
Sheila,‥‥‥だけど、どうしてかしら‥‥‥？　そんな短時間であれだけ増えるなんて‥‥‥,....But... why did it increase in such a short time?
Cooger,あの薬はヴィールス性なんだよ。死霊に噛まれたら一発で感染してしまうよ。,"The resurrection drug had a viral property. Once you get bitten by a zombie, you're infected."
Cooger,あんな薬なんて作らないほうがよかったんだな。,It would've been better if I'd never made that drug...
Sheila,クーガーさん、そんなに気を落とさないでください‥‥‥。,"Dr. Cooger, we can't worry about that now."
Cole,そうだよ、この先どうするかが問題なんだから。後悔するなんてドクらしくないぜ。\nSheila: コール‥‥‥。,"That's right. We can't worry about the past right now, we have to move forward.\nSheila: Cole!"
Cooger,すまんな、二人とも。謝って済むことでないのは十分承知だが‥‥‥許してくれ。,"Still, I'm sorry, both of you. Please forgive me."
Sheila,それで、２階のほうはどうだったの？,What did you find on the second floor?
Cole,ああ、かなり強力な情報を手にいれたよ。,"Well, I got some pretty good information."
Cole,今、思い出しても二階では危なかったな‥‥‥。もう少しで殺られるところだったぜ‥‥‥。,But it was really dangerous; I almost got killed.
Cole,シーラを２階に連れていかなくて良かったよ。もし連れて行ってたら取り返しのつかない事になっていたかもしれないからな。,"I'm glad you weren't there, Sheila. Something horrible might have happened."
Cole,俺と付き合ってたばかりにこんな事に巻き込まれてしまうなんて、シーラにも悪い事をしたな‥‥‥。,I'm just sorry that I involved you in this. If something were to happen...
Cole,二人で資料を片っ端から調べていたようだな。これでは警察署の全部の資料を調べるのに相当時間がかかるぞ。,There was a lot of material to look through. It would take a lot of time to go through it all.
Cole,ドクはまださっきの話を相当気にしているようだな。かなり落ち込んでいる様子だ。無理もない、俺がドクの立場だったら同じ気持ちだろう。,Doc still looks very concerned. I can't blame him. I'd feel the same way in his situation.
Cole,こんなに真剣になったドクを見たのは生まれて初めてだな。,This is the first time I've ever seen Doc so serious.
Cole,さすが警察の資料室だ。ここ何年もの事件や事故の資料がファイルされている。,It's not surprising there's a lot of stuff in the reference room. It's all of their case data for years and years.
Cole,さすがにこれだけの資料を片っ端から調べる時間はないな。,We definitely don't have time to go through it all.
Cole,たしかこれが地図だったよな。,I definietly think this is the map.
Sheila,あった？,It is?
Cole,うん、でもこんな分厚い本を持って行っても邪魔だな‥‥‥破くか。,It's too unwieldy to carry around such a heavy book.
Sheila,えっとニードル川がここだから‥‥‥ホテルはこの辺ね。,"Well, here's the Needle River. So the hotel would be around here."
Cole,よし、行ってみよう。ドク、刀を忘れないようにな。,"Ok, let's go. Doc, don't forget your sword."
Cole,この資料は‥‥‥なんだ、街の地図だ。すげー、こんなに細かく書いてあるんだ‥‥‥。,This page... looks like a map of the city. It's very detailed!
Cole,ドクが手にしている資料は、大企業の裏金についての記録が書かれているようだ。しかし、こんなもの見てどうするつもりなんだ？,The documents Doc has seem to be financial records of some large company. Why is Doc looking at this now?
Cole,こんな本を手にしているところを見ると、ドクはかなり焦っているようだな。,"Looking at the place where you are to hand this kind of book, It looks like Doc is quite impatient."
Cole,シーラの見ているファイルは‥‥‥何かの設計図かな？,Sheila is looking at what looks like some kind of blueprints.
Cole,たぶん、この１６分署の設計資料だろう。俺が２階へ行く前に見つけて欲しかったよ。,It might be a map of the 16th precinct. Wish I had that when I was going to the second floor.
Cole,ドク、さっきから気になってたんだけど‥‥‥これなに？,Doc... what is that?
Cooger,ああ、これはさっきダンボールの中で見つけた刀だよ。日本刀らしいけど、どこかのマフィアから没収してきたものだろうな。,Oh it's a katana I found in a cardboard box. Maybe the police confiscated it from the Mafia.
Cole,ドクは日本刀なんて使えるのかい？,"Doc, can you even use a sword?"
Cooger,わしの爺さんが日本のチャンバラが好きでね。わしも小さい頃に一緒になって見てた事があったよ。爺さんも刀を持ってて‥‥‥何ていったかな、ムラマサとかいったかな。,My niece likes Japanese cinema so I've seen a lot of movies.
Cole,へぇー、初耳だなあ。,First I'm hearing of that.
Cooger,これは護身用だよ。だけどわしはコールの持っている物の方が興味があるよ。,It's for self defense. But what do you have there?
Cole,これかい？　上で拾ったハンドライトなんだけど‥‥‥死霊に襲われた時に落として壊れちゃったみたいで‥‥‥。,This? It's a flashlight but it stopped working when I was attacked by a zombie.
Cole,持ってても使えなきゃ意味ないな。捨てちゃえ。,It doesn't make sense to hold onto a broken flashlight. You should toss is.
Cole,これはマフィアから没収してきた刀だそうだ。俺は刀なんて全然知らないからな、日本は行ってみたいけど‥‥‥。,Seems weird that the Mafia would have a sword. I don't know anything about katanas. I'd love to go to Japan.
Cole,そうだ。ドク、死霊の弱点が判ったんだ！！,Doc! I found the zombie's weakness!
Cooger,なに？　本当か！？,What! Really?!
Cole,ああ、２階の武器庫でいきなり襲われたよ。武器庫だから機関銃の１つでも持って来ようと思ったが、棚はきれいさっぱり何も残ってなかったよ。,"Yeah, I was attacked on the second floor armory. I was hoping to find a machine gun, but all the weapons were gone."
Sheila,コール、大丈夫だった？　怪我はない？,"Cole, are you ok? Were you hurt?"
Cole,ああ、大丈夫さ。逃げ道を失った俺は奴の両目を潰したんだ。だが奴はそれでも俺に向かってきた。多分、奴等は目では物を見ていないだろう。,"I'm okay. I had to crush a zombie's eyes. It was cool, but it was like he could even see me without his eyes."
Cooger,本能だと？,Possibly instinct?
Cole,‥‥‥たぶんね。そして人間を襲うのも本能と考えられるよ。,Maybe. And it's instincts were to kill humans.
Cooger,それで‥‥‥弱点っていうのは？,So you were saying about a weakness?
Cole,うん、棚の陰に落ちてた銃を見つけてね。奴の額に打ち込んだよ。,"Yeah, I managed to find a gun after all and shot him in the head."
Cooger,脳が破壊されれば本能で動く事はないと‥‥‥。,And it can't go by instinct if you destroy the brain.
Cole,ああ、それに奴等の狙いは人間の脳だって事も判ったよ。奴等は人間の脳ミソを喰うために人間を襲っているんだ。複雑な理由は判らないが、これも本能の１つだろうな。,"Oh and it looked like they were after people's brains. I don't know why they'd eat brains, though."
Cooger,そうか‥‥‥コール、君には大きな借りが出来てしまったな。,"I see... Cole, you've learned a lot."
Cole,何言ってんだよ、昔からの仲だろ？　水臭いぜ。,What can I say?
Cooger,‥‥‥‥‥‥‥‥‥‥‥‥。,........
Cole,とにかく奴等の弱点が判ったんだ。生き延びる可能性は十分あるよ。,"Anyway, we know their weakness. We've got a chance to survive."
Cole,でもさ、人間の脳ミソを喰ったところで一体何になるっていうんだ？,"But, I still don't understand why they'd eat human brains."
Cooger,もしかしたら奴等は人間の脳を食料としているのかもしれんな。あの薬は小動物の場合、２分で絶命していたし‥‥‥,"Maybe they eat brains for food. In experiments with small animals, the resurrected ones died after 2 minutes..."
Cooger,死霊になってしまった人間は判らないが、それでもほおっておけばいつかは死んでしまうだろう。,I've never tested on humans (before) but I have to imagine they'd expire after a day.
Cole,まさか‥‥‥死霊の場合だと脳を喰えば生き続ける事ができると！？,"Wait, but could they survive longer if they kept eating brains."
Cooger,判らん‥‥‥だが奴等の求めているのは脳自体ではなく、脳に入っている何かの成分でないかと思うんだよ。奴等には消化機能がなく、脳を喰ったところで栄養になるとは思えんからな。,"I'm not sure. It can't be the brain itself - and there's no digestive function left in the zombies, so it must be some component of the brain, or some chemical."
Cooger,とにかく今のままでは不可解な事が多すぎる。もう少し調べてみないと謎は解明できないな。,But that's just speculation. We'd have to examine more thoroughly.
Cole,だけどさ、俺セントラルホテルって聞いた事ないけど、どんなホテルなんだい？,"I've never heard of Central Hotel, have you?"
Sheila,前に雑誌で読んだ事があるわ‥‥‥たしか各国の大統領が来たときに対談したり、食事したりするためのホテルだったかな。第二のホワイトハウスみたいなものだそうよ。,"I've read about it in magazines. Foreign heads of state would come there for meetings, it's like a remote White House."
Cole,そうか、この資料を見てもかなり大きな建物のようだな。避難場所にはもってこいだ。,The article said it was really large - it'd make a great shelter.
Cooger,場所はどこにあるのかね？,Where is the location?
Sheila,えっと‥‥‥この地区はニードル川の側ね。地図があればなんとか行けると思うけど‥‥‥。,I think it's somewhere in the Needle River district. I coudl tell you if I had a map.
Sheila,コール、その辺に地図なかった？,"Call, there was no map to the side?"
Cole,シーラ、何を調べているんだい？,"Sheila, what are you looking at?"
Sheila,あ、これ？　建設資料みたいだけど‥‥‥どうして警察署なのにこんなものがあるのか、ちょっと気になって見てるの。,"Oh, this? It looks like construction blueprints. Though, I don't know why those are in a police station."
Cole,建設資料？　何の？,Construction materials? For what?
Sheila,えっと‥‥‥セントラルホテルって書いてあるわ。,It says... Central Hotel.
Cole,セントラルホテルって言えば‥‥‥あっ！！　思い出したぞ！！,Central Hotel... oh! Now I remember!
Cole,上の署長室でセントラルホテルが避難場所だってメモがあったんだよ。,There was a memo in the chief's room that said Central Hotel was a shleter.
Cooger,なに？　避難場所！？　そのホテルへみんなで避難しているのか！？,A shelter?! Did everyone evacuate to the hotel already?
Cole,うん、多分そこに行けば生き残った人達がいると思うよ。,"Yeah, I think there might be other survivors there!"
Cole,多分そのホテルに行けば、生き残った人達がいると思うよ。,"Maybe if we go to the hotel, we'll find other survivors."
Cooger,そうか‥‥‥既に街の人はそこに避難を‥‥‥。,"Well, already people evacuated there..."
